name,is_outdoor,price_rating,booking_required,intimate,time_of_day,headline,address_text,address_postcode,meal_type,description_html,external_link,address_longitudinal,address_latitudinal,end_column_unused
Beigel Bake,1,2,1,1,1,Enjoy a traditional salt beef bagel at Beigel Bake,"Beigel Bake, 159 Brick Ln, Shoreditch, London E1 6SB",E1 6SB,other,"Beigel Bake is a cornerstone of the Brick Lane neighbourhood, selling takeaway bagels 24 hours a day and known for having a queue down the block. They are famous for their bagels, baked in the traditional Jewish style, served with hot salf beef and mustard Their other options include sweet pastries and alternative savory bagels (but we're telling you, get the salt beef). Not a surprise that Beigel Bake produces 7,000 beigels every day.",https://twitter.com/beigelbake?lang=en,0,0,1
The Escapologist,1,2,1,1,2,Get delicious creative cocktails and all-star happy hour deals at the Escapologist,"The Escapologist, 35 Earlham Street, Covent Garden, London WC2H 9LD",WC2H 9LD,bar,"The Escapologist is a quirky underground bar with ""unique"" art and a buzzing atmosphere. Their happy hour is not to be missed, where you can score 2 for 1 cocktails, that promise to be embellished with some form of candy, colors or other unique twist. High recommendation for their Espresso Martini.",http://www.escapologistbar.co.uk/,0,0,
Gordon's Wine Bar,1,2,1,1,3,"Grab a bottle of wine in the candlelight, in the vaulted cellars of Gordon's Wine Bar","Gordon's Wine Bar, 47 Villiers St, Charing Cross, London WC2N 6NE,",WC2N 6NE,bar,"Gordon's Wine Bar is perfect for a cosy and romantic glass of wine - it was built in a 19th century vaulted cellar and is lit with candles. Is is also quite popular, so at prime times you may need to be crafty to grab a table in the underground rooms - not suprising for London's oldest wine bar. The wine list is international and top notch and has options to suit all price ranges.",https://gordonswinebar.com/,0,0,1
Iris Bar at the Gherkin,1,3,1,1,2,Enjoy the best 360 London views in London and have a cocktail at Iris bar in the Gherkin,"Iris Bar at the Gherkin, 30 St Mary Axe, London EC3A 8EP",EC3A 8EP,bar,Impress your date with what are arguably the best skyline views in London at this gorgeous 360 rooftop bar. The rooftop is covered so you'll be safe from the elements (no promises about the safety of your wallet). This one must be booked ahead and is the perfect spot for an romantic date or a special occasion. Don't forget to bring ID to get past build security.,https://searcysatthegherkin.co.uk/iris-bar/,0,0,1
The Alchemist,1,3,1,1,2,Try a colour-changing cocktail at the Alchemist,"The Alchemist, 63-66 St Martins Lane, London WC2N 4JS",WC2N 4JS,bar,"The Alchemist is a hip and cosy bar with top-notch cocktails. Expect colour-changing, taste-changing, smoke-emitting, fire-blazing cocktails, that are sure to impress.",https://thealchemist.uk.com/,0,0,1
Kanada-Ya - Covent Garden,1,2,1,1,3,Try truffle ramen or a flavourful tonkotsu at Kanada-Ya,"Kanada-Ya, Covent Garden, 64 St Giles High Street, London WC2H 8LE",WC2H 8LE,restaurant,"There are a number of ramen options in London, but few can deliver bowls of noodles that are as outstanding as Kanada-Ya. Try their Tonkotsu with soft chashu pork belly and crunchy wood ear mushroom. For something for unique, their Truffle ramen is to die for - pork bone broth with infusions of truffle paste and white truffle oil.",https://www.kanada-ya.com,0,0,1
Monohon,1,2,1,1,3,Try delicious (Londoner-crafted) ramen and soba at Monohon,"Monohon, 102 Old Street, London EC1V 9AY",EC1V 9AY,restaurant,"Founded by an ex-corporate Londoner who decided to move to Japan to learn how to make ramen, Monohon delivers some of the best bowls of noodles in London. This cosy outpost offers ramen and soba at reasonable prices and of top quality.",http://monohonramen.com/,0,0,1
Menya Ramen,1,2,1,1,3,Have an authentic bowl of ramen at Menya,"Menya Ramen, 29 Museum St, Holborn, London WC1A 1LH",WC1A 1LH,restaurant,"Hidden away on a side-street, Menya is a casual spot to grab a bowl of delicious and authentic Japanese ramen. Their menu is short and to the point. Ideal spot for a first date or a stop on the way to another destination.",,0,0,1
Padella,1,2,1,1,3,Order delicious pasta dishes at Padella,"Padella, 6 Southwark St, London SE1 1TQ",SE1 1TQ,restaurant,"The acclaim Padella has received is well-deserved - this cosy spot offers incredible pastas to share at very reasonable prices. We recommend at least three pasta dishes per couple. While their menu is ever-rotating, the ""Pappardelle with 8 hours Dexter beef shin ragu"" and the ""Pici cacio & pepe"" are ever popular. There will likely be a wait, so write your name down on arrival and go for a drink around the many bars surrounding nearby Borough Market while you wait for your table.",https://www.padella.co/,0,0,1
Duck & Waffle - Restaurant,1,3,1,1,3,"Enjoy a waffle in a stylish venue overlooking 360 views of London, at Duck & Waffle","Duck & Waffle, 110 Bishopsgate, London EC2N 4AY",EC2N 4AY,restaurant,"Duck & Waffle, with its modern decor and 360 London skyscraper views, is probably most famous for serving waffles 24 hours a day. During themore reasonable hours you can book a table and try their signature duck leg and waffle dish, and try their unique and delicious small plates. The setting is perfect for a stylish and romantic meal. Pro tip: the glass elevator to the 38th floor will give you a rush as you look out over the city.",https://duckandwaffle.com/,0,0,1
Duck & Waffle - Bar,1,3,1,1,3,Have a cocktail and enjoy London skyline views at the stylish Duck & Waffle,"Duck & Waffle, 110 Bishopsgate, London EC2N 4AY",EC2N 4AY,bar,"The bar at Duck & Waffle is stylish, modern and romantic, boasting beautiful London skyscraper views. It is a common spot for out of towners given the atmosphere and trendy vibes.  Pro tip: the glass elevator to the 38th floor will give you a rush as you look out over the city.",https://duckandwaffle.com/,0,0,1
SushiSamba - Bar - The City,1,3,1,1,3,"Enjoy skyline views, hip beats and cocktails at the trendy SushiSamba","Sushisamba, 110 Bishopsgate, London EC2N 4AY",EC2N 4AY,bar,"SushiSamba's sexy rooptop bar has beats, cocktails and a beautiful scenery. Step into their indoor bar for a Japanese themed area with sweeping skyline views of London. This is a perfectly fun and intimate location to end the night. ",https://www.sushisamba.com/,0,0,1
Madison - Bar,1,3,1,1,3,Enjoy skyline views over St.Paul's and a beautiful outdoor terrace at Madison,"Madison Restaurant, Rooftop Terrace, One New Change, St Paul’s, London EC4M 9AF",EC4M 9AF,bar,"Madison has some of the best rooftop bar views in London, with a beautiful viewing area over St.Paul's. In the winter, heat lamps keep the outdoor area warm. Go on a Friday or Saturday night for great beats and more of a party atmosphere.",https://www.madisonlondon.net/,0,0,1
Hoppers Soho,1,3,1,1,3,Try mouthwatering Sri Lankan food at Hoppers Soho,"Hoppers, 49 Frith Street, London W1D 4SG",W1D 4SG,restaurant,"Hoppers is a super popular London hotspot for Sri Lankan food. At prime times, get there early to put your name on the waitlist - you can go grab a drink at a bar nearby as you can count on the fact that there will be a wait. Their signature ""hoppers"" (large crispy pancakes) are a must try, as well as their bone marrow curry and devilled prawns.",https://www.hopperslondon.com/,0,0,1
Din Tai Fung,1,3,1,1,3,Enjoy dim sum and top-notch Shanghainese soup dumplings at Din Tai Fung,"Din Tai Fung, 5-6 Henrietta Street, Covent Garden, London WC2E 8PS",WC2E 8PS,restaurant,"Straight out of Taiwan, Din Tai Fung has become a global sensation. They are most famous for their xiao long bao, delicious pork dumplings filled with soup. Get ready to share new foods as their menu is dim sum style. The restaurant doesn't accept reservations but you can grab a drink (or a Taiwanese bubble tea) at their bar while you wait for a table.",https://www.dintaifung-uk.com/,0,0,1
Barrica,1,3,1,1,3,Feast on delicious Spanish tapas plates at Barrica,"Barrica, 62 Goodge Street, London W1T 4NE",W1T 4NE,restaurant,"Barrica's tapas are authentic, delicious and not to be missed. Try the Galician octopus, bellota jamón (sliced ham pigs fed soley acorns), patatas bravas, and the cuttle fish black ink rice. The atmosphere is cosy and intimate and the neighbourhood is bustling.",http://www.barrica.co.uk/,0,0,1
Saltyard,1,3,1,1,3,Taste Spanish-Italian fusion tapas at Saltyard,"Saltyard, 54 Goodge Street, London W1T 4NA.",W1T 4NA,restaurant,"Saltyard is a fusion of Spanish and Italian cuisine, specialising in small plates and charcuterie. Here you can enjoy variations on familiar Spanish tapas favourites, while enjoying the cosy and intimate atmosphere.",https://www.saltyardgroup.co.uk/salt-yard-group-venues/salt-yard,0,0,1
Skypod at Skygarden,1,3,1,1,3,Enjoy 360 London views and a beautiful indoor rooftop garden at Skypod,"Sky Garden, 1 Sky Garden Walk, London EC3M 8AF",EC3M 8AF,bar,"Skypod is the bar at London's Skygarden, a (covered) rooftop garden with a 360 degree view of London. Walk-ins are welcome without a booking in the evenings, which are the best time to go to see the skyscrapers and bridges of London lit up. Cocktails are tasty, and the views along the walking path perimeter of the rooftop will keep the conversation flowing as fast as the drinks.",https://skygarden.london/sky-pod-bar,0,0,1
Circus,1,4,1,1,2,Eat dinner with a live circus performance at Circus,"27-29 Endell St, London WC2H 9BA",WC2H 9BA,restaurant,,,0,0,1
The Blind Pig,1,3,1,1,3,Grab cocktails at the low-lit and quaint Blind Pig in The Social Eating House,"Social Eating House, 58 Poland St, Soho, London W1F 7NR",W1F 7NQ,bar,,,0,0,1
Scarfes Library Bar,1,5,1,1,2,Have a cocktail or whisky at this swanky but cosy bar at the Rosewood,"Rosewood London, 252 High Holborn, Holborn, London WC1V 7EN",WC1V 7EN,bar,,http://scarfesbar.com,0,0,1
The Little Yellow Door,1,4,1,1,2,Listen to music and grab a drink at this house party style bar,"6-8 All Saints Rd, Notting Hill, London W11 1HH",W11 1HH,bar,,http://thelittleyellowdoor.com,0,0,1
The Big Chill House,1,3,1,1,3,Enjoy beers on a chill rooftop at The Big Chill House,"257-259 Pentonville Rd, London N1 9NL",N1 9NL,bar,,https://bigchillbar.com/kings-cross,0,0,1
BYOC -Bring Your Own Cocktail - Camden,1,3,1,1,2,Bring along your favourite booze and get bespoke cocktails mixed,"11-13 Camden High St, Kings Cross, London NW1 7JE",NW1 7JE,bar,,https://www.byoc.co.uk/,0,0,1
Mayor of Scaredy Cat Town,1,3,1,1,2,"Have a cocktail at this tiny, secret bar Mayor fo Scaredy Cat Town - just make sure you know the password!","12-16 Artillery Ln, Spitalfields, London E1 7LS",E1 7LS,bar,,,0,0,1
The Connaught,1,5,1,1,3,Grab a martini at this ritzy hotel bar at the Connaught,"Carlos Pl, Mayfair, London W1K 2AL",W1K 2AL,bar,,http://the-connaught.co.uk,0,0,1
The Boundary Rooftop,1,3,1,1,3,Enjoy a spectacular London view and décor alonside your cocktail,"2-4 Boundary St, Redchurch St, Hackney, London E2 7DD",E2 7DD,bar,,https://boundary.london/rooftop/,0,0,1
The Hide Bar,1,3,1,1,3,Grab a brew or cocktail at this warehouse bar,"39-45 Bermondsey St, Bermondsey, London SE1 3XF",SE1 3XF,bar,,http://thehidebar.com,0,0,1
Courtesan Dim Sum,1,3,1,1,3,Try some Chinese dim sum at this hip venue in a dim old-fashioned setting,"69-73 Atlantic Road, Brixton SW9 8PU",SW9 8PU,bar,,http://thecourtesan.co.uk,0,0,1
The Prince,1,3,1,1,3,"Grab a beer at this massive leafy pub and garden, which doubles as a food court","14 Lillie Rd, Hammersmith, London SW6 1TT",SW6 1TT,bar,,http://theprincelondon.com,0,0,1
Bar Elba,1,2,1,1,3,"Grab a cocktail on a buzzing rooftop, perfect for weekends and enjoying some music","Rooftop Mercury House, 109-117 Waterloo Rd, Lambeth, London SE1 8UL",SE1 8UL,bar,,http://bar-elba.co.uk,0,0,1
Frank's Café,1,2,1,1,3,Enjoy a cocktail at this hip roofop bar atop a Peckham carpark.,"95A Rye Lane | 10TH Floor, Peckham Multi-Story Carpark, London SE15 4ST",SE15 4ST,bar,,,0,0,1
Opium Cocktail Bar,1,3,1,1,2,Grab a hip Asian-inspired cocktail at this secret bar with top ambiance.,"15-16 Gerrard St, London W1D 6JE",W1D 6JE,bar,,,0,0,1
Experimental Cocktail Club,1,3,1,1,2,Have an intricately-crafted and delicious cocktail at this multi-story secret bar in Chinatown.,"13a Gerrard St, Chinatown, London W1D 5PS",W1D 5PS,bar,,,0,0,1
Cahoots,1,4,1,1,2,,"13 Kingly Ct, Soho, London W1B 5PW",W1B 5PW,bar,,,0,0,1
Sea Containers,1,4,1,1,3,,"20 Upper Ground, South Bank, London SE1 9PD",SE1 9PD,bar,,,0,0,1
Rumpus Room,1,4,1,1,3,,"20 Upper Ground, South Bank, London SE1 9PD",SE1 9PD,bar,,,0,0,1
Radio Bar,1,4,1,1,3,,"336-337 Strand, London WC2R 1HA",WC2R 1HA,bar,,,0,0,1
Zela Bar,1,4,1,1,2,,"336-337 Strand, London WC2R 1HA",WC2R 1HA,bar,,,0,0,1
La Bodega Negra,1,4,1,1,2,,"9 Old Compton St, Soho, London W1D 5JF",W1D 5JF,bar,,,0,0,1
Vagabond Victoria,1,3,1,1,3,"A must-go for wine lovers, try hundreds of international wines from vending machine style dispensers at this buzzing spot.\","Unit 17, 77 Buckingham Palace Rd, Westminster, London SW1W 0AJ",SW1W 0AJ,bar,,,0,0,1
Mr. Fogg's Hous of Botanicals,1,4,1,1,2,,"48 Newman St, Fitzrovia, London W1T 1QQ",W1T 1QQ,bar,,,0,0,1
Shochu Lounge,1,3,1,1,2,,"37 Charlotte St, Fitzrovia, London W1T 1RR",W1T 1RW,bar,,,0,0,1
Reverend J W Simpson,1,3,1,1,2,,"32 Goodge St, Bloomsbury, London W1T 2QJ",W1T 2QJ,bar,,,0,0,1
Coppa Club,1,3,1,1,3,,"3 Three Quays Walk, Lower Thames St, London EC3R 6AH",EC3R 6AH,bar,,,0,0,1
Darcie & May Green,1,3,1,1,3,,"Grand Union Canal, Sheldon Square, Paddington Central W2 6DS",W2 6DS,bar,,,0,0,1
Pergola Paddington,1,3,1,1,3,,"4 Kingdom St, London W2 6PY",W2 6PY,bar,,,0,0,1
Pergola Olympia,1,3,1,1,3,,"Level Five Rooftop, Olympia Car Park, Olympia Way W14 8UX",W14 8UX,bar,,,0,0,1
Jin Bo Law,1,4,1,1,3,,"14th floor, 9, Dorsett City, Aldgate High St, London EC3N 1AH",EC3N 1AH,bar,,,0,0,1
The Gibson,1,3,1,1,2,,"44 Old St, London EC1V 9AQ",EC1V 9AQ,bar,,,0,0,1
Discount Suit Company,1,3,1,1,2,,"29A Wentworth St, Spitalfields, London E1 7TB",E1 7TB,bar,,,0,0,1
The Booking Office,1,4,1,1,3,,"St. Pancras Renaissance Hotel, Euston Rd, London NW1 2AR",NW1 2AR,bar,,,0,0,1
The Crown and Shuttle,1,3,1,1,3,,"226 Shoreditch High St, Hackney, London E1 6PJ",E1 6PJ,bar,,,0,0,1
Nightjar,1,4,1,1,2,,"129 City Rd, Hoxton, London EC1V 1JB",EC1V 1JB,bar,,,0,0,1
The Book Club,1,3,1,1,2,,"100-106 Leonard St, Hackney, London EC2A 4RH",EC2A 4RH,bar,,,0,0,1
The Cocktail Trading Company,1,3,1,1,2,,"68 Bethnal Green Rd, Shoreditch, London E1 6GQ",E1 6GQ,bar,,,0,0,1
Brewdog Shoreditch,1,3,1,1,3,,"51 Bethnal Green Rd, Shoreditch, London E1 6LA",E1 6LA,bar,,,0,0,1
Upper 5th,1,3,1,1,3,,"Courthouse Hotel Shoreditch, 335-337 Old St, London EC1V 9LL",EC1V 9LL,bar,,,0,0,1
Shaka Zulu,1,4,1,1,2,,"Stables Market, Chalk Farm Rd, London NW1 8AB",NW1 8AB,bar,,,0,0,1
Netil360,1,3,1,1,3,Grab a cocktail at this laid back outdoor rooftop bar with excellent views of London,"1 Westgate St, London E8 3R",E8 3RL,bar,,,0,0,1
The Cauldron,1,3,1,1,2,,"79 Stoke Newington Rd, Stoke Newington, London N16 8AD",N16 8AD,bar,,,0,0,1
Ballieballerson,1,3,1,1,2,Jump in a ball pit and sip a retro cocktail at this fun hangout - check the website for the current theme!,"97-113 Curtain Rd, Hackney, London EC2A 3BS",EC2A 3BS,bar,,,0,0,1
Macellaio RC Fitzrovia,1,4,1,1,3,Try a steak to die for at this casual Italian restaurant,"6 Store St, Bloomsbury, London WC1E 7DQ",WC1E 7DQ,restaurant,,,0,0,1
Park Chinois,1,5,1,1,2,Enjoy a swanky night out at this opulent Chinese restaurant - check their website for the times of live music performances!,"17 Berkeley St, Mayfair, London W1J 8EA",W1J 8EA,restaurant,,,0,0,1
Sexy Fish,1,5,1,1,3,This high-end and art-filled fish restaurant will serve you creative dishes in a top atmosphere!,"Berkeley Square House, Berkeley Square, Mayfair, London W1J 6BR",W1J 6BR,restaurant,,,0,0,1
Lao Café,1,3,1,1,3,"Try traditional Lao cuisine, including funky dishes like ant egg soup!","60 Chandos Pl, Covent Garden, London WC2N 4HG",WC2N 4HG,restaurant,,,0,0,1
Xu,1,4,1,1,3,Enjoy some dim sum and traditional Taiwanese teas at this stylish restaurant based on 1930s Taipei!,"30 Rupert St, London W1D 6DL",W1D 6DL,restaurant,,,0,0,1
The Palomar,1,3,1,1,3,Enjoy some top-notch and modern Jerusalem food in this hip spot - just don't forget to make a reservation in advance!,"34 Rupert St, London W1D 6DN",W1D 6DN,restaurant,,,0,0,1
Ichibuns,1,3,1,1,3,"Grab ramen and wagyu burgers at this Japanese restaurant, with some of the coolest décor (and bathrooms) in London!","22 Wardour St, London W1D 6QQ",W1D 6QQ,restaurant,,,0,0,1
Casita Andina,1,3,1,1,3,Enjoy traditional Peruvian ceviches and piscos at this top spot for Peruvian food!,"31 Great Windmill St, Soho, London W1D 7LP",W1D 7DT,restaurant,,,0,0,1
Lanzhou Noodle Bar,1,2,1,1,3,"Although the atmosphere is basic, this low-key and traditional hand-pulled Chinese noodle spot is as authentic (and delicious) as it gets!","33 Cranbourn St, Covent Garden, London WC2H 7AD",WC2H 7AD,restaurant,,,0,0,1
Leong's Legend,1,3,1,1,3,Come to Leong's Legend in Chinatown for their bottomless brunch dim sums and their beef noodle soup!,"39 Gerrard St, London W1D 5QD",W1D 5QD,restaurant,,,0,0,1
Dirty Bones - Soho,1,3,1,1,3,"This American restaurant offers stables like fried chicken and pancakes, in a cool industrial space.","14 Denman St, Soho, London W1D 7HJ",W1D 7HJ,restaurant,,,0,0,1
Where The Pankakes Are,1,3,1,1,3,Grab a place of unforgettable (and very instagrammable) pancakes any time of the day!,"Arch 35a, 85a Southwark Bridge Rd, London SE1 0NQ",SE1 0NQ,restaurant,,,0,0,1
Bar Douro,1,3,1,1,3,Grab some top ranked Portuguese sharing places and Portuguese wines at this beautiful tiled restaurant.,"Arch 35a, 85a Southwark Bridge Rd, London SE1 0NQ",SE1 0NQ,restaurant,,,0,0,1
Yeni,1,4,1,1,3,"This mediterranean restaurant is a fan favourite, with a cosy vibe and top notch small plates.","55 Beak St, Soho, London W1F 9SH",W1F 9SH,restaurant,,,0,0,1
Sketch,1,5,1,1,3,"This iconic London restaurant has some of the most hip and memorable décor in London, a perfect combo of atmosphere and quality food.","9 Conduit St, Mayfair, London W1S 2XG",W1S 2XG,restaurant,,,0,0,1
Yoobi Sushi - Soho,1,3,1,1,3,Grab Japanese hand-rolled sushis at this cool modern spot.,"38 Lexington St, Soho, London W1F 0LL",W1F 0LL,restaurant,,,0,0,1
Bao - Fitzrovia,1,3,1,1,3,Bao Fitzrovia serves up highly popular bao buns with asian-inspired fillings - try one of each!,"31 Windmill St, Fitzrovia, London W1T 2JN",W1T 2JN,restaurant,,,0,0,1
Maison Bab,1,3,1,1,3,"This casual, modern and delicious kebab spot is perfect for a contemporary spin on Middle Eastern eats.","4 Mercer Walk, Covent Garden, London WC2H 9FA",WC2H 9FA,restaurant,,,0,0,1
Le Bab,1,2,1,1,3,Grab delicious kebab and shawarma at this stylish and casual Middle Eastern spot.,"Top Floor, Kingly Court, Carnaby Street, London W1B 5PW",W1B 5PW,restaurant,,,0,0,1
Red Farm,1,3,1,1,3,Grab memorable Chinese dim sum dishes - soup dumplings you need to drink with a straw and Pac Man dumplings!,"9 Russell St, Covent Garden, London WC2B 5HZ",WC2B 5HZ,restaurant,,,0,0,1
Yauatcha,1,4,1,1,3,"Chinese dim sum at top quality to match the price, in a hip and modern interior and beautiful hand-crafted desserts.","15-17 Broadwick St, Soho, London W1F 0DL",W1F 0DL,restaurant,,,0,0,1
Lobos Meat and Tapas - Borough,1,3,1,1,3,"Cosy atmosphere under rail arches for tasty Spanish tapas - Iberian ham, croquetas and octopus!","14 Borough High St, London SE1 9QG",SE1 9QG,restaurant,,,0,0,1
Princi,1,3,1,1,3,Counter-style Italian pizzeria with a casual and buzzing café atmosphere.,"135 Wardour St, Soho, London W1F 0UT",W1F 0UT,restaurant,,,0,0,1
Barrafina - Soho,1,4,1,1,3,Cosy and ever popular spot for some of the best Spanish tapas in London.,"26-27 Dean St, Soho, London W1D 3LL",W1D 3LL,restaurant,,,0,0,1
Barrafina - Covent Garden,1,3,1,1,3,Cosy and ever popular spot for some of the best Spanish tapas in London.,"43 Drury Ln, Covent Garden, London WC2B 5AJ",WC2B 5AJ,restaurant,,,0,0,1
The Breakfast Club - Spitalfields,1,3,1,1,3,"Choose from tasty breakfast dishes at this hugely popular spot, in a casual and quirky atmosphere.","12-16 Artillery Ln, Spitalfields, London E1 7LS",E1 7LS,restaurant,,,0,0,1
Jose,1,3,1,1,3,Grab some authentic Spanish tapas at this tiny and cosy restaurant.,"104 Bermondsey St, Bermondsey, London SE1 3UB",SE1 3UB,restaurant,,,0,0,1
Scarlett Green,1,3,1,1,3,Stop by this trendy and modern café for delicious Australian dishes - especially for brunch!,"4 Noel St, Soho, London W1F 8GB",W1F 8GB,restaurant,,,0,0,1
Hutong,1,5,1,1,3,Upscale Chinese dim sum and dishes with stunning skyline views and swanky Asian decor - this spot is one of a kind!,"33, The Shard, 31 St Thomas St, London SE1 9RY",SE1 9RY,restaurant,,,0,0,1
Circolo Poppolare,1,4,1,1,3,"Very popular Italian spot for Sicilian dishes, with stunning décor decorated with over 20,000 bottles lining the walls.","40-41 Rathbone Pl, Fitzrovia, London W1T 1HX",W1T 1HX,restaurant,,,0,0,1
My Old Dutch,1,3,1,1,3,Traditional Dutch pancakes ALL DAY - both savoury and sweet!,"131-132 High Holborn, Holborn, London WC1V 6PS",WC1V 6PS,restaurant,,,0,0,1
Archipelago,1,4,1,1,3,"Quirky and exotic restaurant, to try meats like Zebra and Crocodile with a side of insects.","131-132 High Holborn, Holborn, London WC1V 6PS",WC1V 6PS,restaurant,,,0,0,1
Twist at Crawford,1,3,1,1,3,Chic international tapas spot in a stylish atmosphere - and absolutely top marks from diners.,"42 Crawford St, Marylebone, London W1H 1JW",W1H 1JW,restaurant,,,0,0,1
Opso,1,4,1,1,3,Stylish Greek restaurant for a cosy and fun dinner.,"10 Paddington St, Marylebone, London W1U 5QL",W1U 5QL,restaurant,,,0,0,1
Uli,1,3,1,1,3,"Pretty and contemporary Asian restaurant with Thai, Vietnamese and Chinese dishes.","5 Ladbroke Rd, Notting Hill, London W11 3PA",W11 3PA,restaurant,,,0,0,1
Kyseri,1,3,1,1,3,Casual and top-rated Turkish restaurant - grab a few flavourful small plates and a glass of wine.,"64 Grafton Way, Bloomsbury, London W1T 5DN",W1T 5DN,restaurant,,,0,0,1
Saporitalia,1,3,1,1,3,Cosy Italian gem of a restaurant in Notting Hill for authentic and affordable pizza and pasta.,"271 Portobello Rd, Notting Hill, London W11 1LR",W11 1LR,restaurant,,,0,0,1